종류,상품명,상품설명,한도,이자율
신용대출,신한 새희망드림 대출,은행권 금융 이용이 어려운 서민고객 대상,1천만원,5.2
신용대출,쏠편한 직장인 대출,바쁜 직장인을 위해 서류제출을 생략한 빠른 직장인 신용대출,5천만원,4.71
신용대출,쏠편한 포켓론,신용카드를 보유 중인 개인 대상,5백만원,4.19
신용대출,샐러리론,신한은행 급여이체 고객을 위한 특별한 대출 서비스,5천만원,4.21
신용대출,쏠편한 일반공무원 대출,대한민국 공무원을 응원하는 넉넉한 한도의 신용 대출,1억 5천만원,3.82
신용대출,쏠편한 소방공무원 대출,대한민국 안전에 힘 쓰는 소방공무원을 위한 쉽고 빠른 119 신용대출,1억 5천만원,3.82
신용대출,쏠편한 군인 대출,나라를 지키는 고마운 군인을 위해 언제 어디서나 가능한 모바일 신용대출,1억 5천만원,3.83
신용대출,쏠편한 새희망홀씨 대출,소득과 신용기준을 완화하여 보다 많은 직장인들에게 희망을 드리는 신용 대출,3천만원,6.18
신용대출,군인생환안전자금 대출 ,군인공제회 회원 대상 군인공제회에 불입한 회원부담금 총액의 90% 범위 내 생활자금 지원 대출,회원부담금 총액의 90%,3.13
신용대출,신한 징검다리론,정책 서민금융 상품을 성실히 상환하신 분들을 대상으로 은행 자금을 지원하는 신용대출 상품,3천만원,3.77
신용대출,"신한 대학생,청년 햇살론","신한 대학생,청년 햇살론",1천 2백만원,4.5
신용대출,신한 햇살론뱅크,서민금융진흥원의 보증서를 통한 긴급샐활자금 및 고금리대출 대환 지원상품,2천만원,4.0
신용대출,신한 햇살론 15,국민행복기금의 보증서를 담보로 긴급생활자금을 지원하는 상품,1천 4백만원,15.9
신용대출,쏠편한 햇살론 Youth 대출,취업준비생 및 사회초년생의 건전한 금융거래를 지원하는 보증서 담보 대출 상품,1천 2백만원,3.5
